{"schema_version":1,"mode":"demo","generated_utc":"2026-10-19T12:00:00Z","as_of_utc":"2026-10-19T12:00:00Z","source":"demo-generator","account":{"label":"PAPER (simulated)","currency":"USD","initial":10000,"equity":9615.25,"day_pnl":-9.15,"week_pnl":-83.1,"drawdown_pct":4.976,"max_drawdown_pct":5.297,"risk_per_trade_pct":0.25,"open_positions":[{"id":"T-0121","symbol":"XAUUSD","side":"BUY","entry":4038.5,"stop_loss":4031.6,"take_profit":4045.41,"opened_utc":"2026-10-19T11:20:00Z","floating_r":-0.07},{"id":"T-0122","symbol":"GBPJPY","side":"SELL","entry":193.682,"stop_loss":193.823,"take_profit":193.54,"opened_utc":"2026-10-19T11:34:00Z","floating_r":0.104}],"exposure":[{"symbol":"XAUUSD","risk_r":1,"share_pct":50},{"symbol":"GBPJPY","risk_r":1,"share_pct":50}],"limits":{"daily_loss_pct":1,"max_drawdown_pct":8,"max_open_positions":3,"risk_per_trade_pct":0.25}},"equity_curve":[{"t":1789948800,"equity":10000,"drawdown_pct":0},{"t":1790049120,"equity":9975,"drawdown_pct":0.25},{"t":1790049660,"equity":10012.5,"drawdown_pct":0},{"t":1790061120,"equity":10032.48,"drawdown_pct":0},{"t":1790074680,"equity":10047.65,"drawdown_pct":0},{"t":1790101260,"equity":10053.3,"drawdown_pct":0},{"t":1790124420,"equity":10078.3,"drawdown_pct":0},{"t":1790150820,"equity":10115.8,"drawdown_pct":0},{"t":1790166480,"equity":10118.8,"drawdown_pct":0},{"t":1790173380,"equity":10093.8,"drawdown_pct":0.247},{"t":1790175060,"equity":10068.8,"drawdown_pct":0.494},{"t":1790177760,"equity":10043.8,"drawdown_pct":0.741},{"t":1790188800,"equity":10058.72,"drawdown_pct":0.594},{"t":1790227140,"equity":10033.72,"drawdown_pct":0.841},{"t":1790235900,"equity":10058.72,"drawdown_pct":0.594},{"t":1790239560,"equity":10033.72,"drawdown_pct":0.841},{"t":1790241540,"equity":10008.72,"drawdown_pct":1.088},{"t":1790276760,"equity":10033.72,"drawdown_pct":0.841},{"t":1790299620,"equity":10036.1,"drawdown_pct":0.817},{"t":1790304000,"equity":10011.1,"drawdown_pct":1.064},{"t":1790330460,"equity":10036.1,"drawdown_pct":0.817},{"t":1790332500,"equity":10061.1,"drawdown_pct":0.57},{"t":1790332980,"equity":10036.1,"drawdown_pct":0.817},{"t":1790335680,"equity":10073.6,"drawdown_pct":0.447},{"t":1790339640,"equity":10048.6,"drawdown_pct":0.694},{"t":1790340780,"equity":10023.6,"drawdown_pct":0.941},{"t":1790347020,"equity":9998.6,"drawdown_pct":1.188},{"t":1790361600,"equity":10007.1,"drawdown_pct":1.104},{"t":1790564760,"equity":9995.02,"drawdown_pct":1.223},{"t":1790578020,"equity":9970.02,"drawdown_pct":1.47},{"t":1790581260,"equity":9945.02,"drawdown_pct":1.717},{"t":1790582700,"equity":9920.02,"drawdown_pct":1.964},{"t":1790584500,"equity":9934.9,"drawdown_pct":1.817},{"t":1790596980,"equity":9959.9,"drawdown_pct":1.57},{"t":1790681640,"equity":9934.9,"drawdown_pct":1.817},{"t":1790708580,"equity":9916.9,"drawdown_pct":1.995},{"t":1790711400,"equity":9935.8,"drawdown_pct":1.809},{"t":1790751360,"equity":9910.8,"drawdown_pct":2.056},{"t":1790764920,"equity":9925.8,"drawdown_pct":1.907},{"t":1790767140,"equity":9940.8,"drawdown_pct":1.759},{"t":1790767980,"equity":9969.45,"drawdown_pct":1.476},{"t":1790786280,"equity":9984.42,"drawdown_pct":1.328},{"t":1790792340,"equity":9959.42,"drawdown_pct":1.575},{"t":1790793420,"equity":9934.42,"drawdown_pct":1.822},{"t":1790795280,"equity":9909.42,"drawdown_pct":2.069},{"t":1790804280,"equity":9902.2,"drawdown_pct":2.141},{"t":1790804700,"equity":9898.05,"drawdown_pct":2.182},{"t":1790826660,"equity":9873.05,"drawdown_pct":2.429},{"t":1790836260,"equity":9888.05,"drawdown_pct":2.28},{"t":1790839680,"equity":9903.05,"drawdown_pct":2.132},{"t":1790865540,"equity":9878.05,"drawdown_pct":2.379},{"t":1790876220,"equity":9866.62,"drawdown_pct":2.492},{"t":1790882760,"equity":9841.62,"drawdown_pct":2.739},{"t":1790891040,"equity":9833.62,"drawdown_pct":2.818},{"t":1790897940,"equity":9871.17,"drawdown_pct":2.447},{"t":1790970720,"equity":9846.17,"drawdown_pct":2.694},{"t":1791162000,"equity":9837.52,"drawdown_pct":2.78},{"t":1791167400,"equity":9841.45,"drawdown_pct":2.741},{"t":1791168480,"equity":9856.57,"drawdown_pct":2.591},{"t":1791184380,"equity":9894.1,"drawdown_pct":2.221},{"t":1791221100,"equity":9909.1,"drawdown_pct":2.072},{"t":1791240480,"equity":9904.6,"drawdown_pct":2.117},{"t":1791246900,"equity":9879.6,"drawdown_pct":2.364},{"t":1791253020,"equity":9854.6,"drawdown_pct":2.611},{"t":1791306060,"equity":9842.97,"drawdown_pct":2.726},{"t":1791308220,"equity":9845.8,"drawdown_pct":2.698},{"t":1791309060,"equity":9857.67,"drawdown_pct":2.581},{"t":1791322620,"equity":9837.17,"drawdown_pct":2.783},{"t":1791322800,"equity":9837.75,"drawdown_pct":2.778},{"t":1791329820,"equity":9829.25,"drawdown_pct":2.862},{"t":1791355740,"equity":9804.25,"drawdown_pct":3.109},{"t":1791358320,"equity":9829.25,"drawdown_pct":2.862},{"t":1791386340,"equity":9804.25,"drawdown_pct":3.109},{"t":1791402420,"equity":9829.22,"drawdown_pct":2.862},{"t":1791424560,"equity":9832.15,"drawdown_pct":2.833},{"t":1791425400,"equity":9807.15,"drawdown_pct":3.08},{"t":1791429420,"equity":9844.62,"drawdown_pct":2.71},{"t":1791433740,"equity":9819.62,"drawdown_pct":2.957},{"t":1791434340,"equity":9794.62,"drawdown_pct":3.204},{"t":1791460860,"equity":9818.12,"drawdown_pct":2.971},{"t":1791488040,"equity":9833.05,"drawdown_pct":2.824},{"t":1791506700,"equity":9832.47,"drawdown_pct":2.83},{"t":1791517560,"equity":9807.47,"drawdown_pct":3.077},{"t":1791517860,"equity":9816.85,"drawdown_pct":2.984},{"t":1791524160,"equity":9831.75,"drawdown_pct":2.837},{"t":1791530820,"equity":9806.75,"drawdown_pct":3.084},{"t":1791536160,"equity":9844.25,"drawdown_pct":2.713},{"t":1791548700,"equity":9819.25,"drawdown_pct":2.96},{"t":1791569880,"equity":9794.25,"drawdown_pct":3.207},{"t":1791577140,"equity":9809.17,"drawdown_pct":3.06},{"t":1791577140,"equity":9784.17,"drawdown_pct":3.307},{"t":1791769740,"equity":9759.17,"drawdown_pct":3.554},{"t":1791780480,"equity":9748.35,"drawdown_pct":3.661},{"t":1791786660,"equity":9723.35,"drawdown_pct":3.908},{"t":1791790080,"equity":9698.35,"drawdown_pct":4.155},{"t":1791831060,"equity":9692.37,"drawdown_pct":4.214},{"t":1791831660,"equity":9702.45,"drawdown_pct":4.115},{"t":1791832140,"equity":9705.5,"drawdown_pct":4.084},{"t":1791892440,"equity":9720.5,"drawdown_pct":3.936},{"t":1791935160,"equity":9713.5,"drawdown_pct":4.005},{"t":1791947160,"equity":9688.5,"drawdown_pct":4.252},{"t":1791973800,"equity":9670.67,"drawdown_pct":4.429},{"t":1791986880,"equity":9645.67,"drawdown_pct":4.676},{"t":1791996780,"equity":9645.17,"drawdown_pct":4.681},{"t":1792036080,"equity":9655.32,"drawdown_pct":4.58},{"t":1792055580,"equity":9663.32,"drawdown_pct":4.501},{"t":1792072560,"equity":9638.32,"drawdown_pct":4.748},{"t":1792077060,"equity":9663.47,"drawdown_pct":4.5},{"t":1792079340,"equity":9638.47,"drawdown_pct":4.747},{"t":1792093560,"equity":9642.32,"drawdown_pct":4.709},{"t":1792105920,"equity":9631.32,"drawdown_pct":4.818},{"t":1792127340,"equity":9606.32,"drawdown_pct":5.065},{"t":1792133820,"equity":9607.82,"drawdown_pct":5.05},{"t":1792138500,"equity":9582.82,"drawdown_pct":5.297},{"t":1792139220,"equity":9597.82,"drawdown_pct":5.149},{"t":1792145280,"equity":9594.82,"drawdown_pct":5.178},{"t":1792160220,"equity":9609.82,"drawdown_pct":5.03},{"t":1792163100,"equity":9634.82,"drawdown_pct":4.783},{"t":1792171380,"equity":9624.4,"drawdown_pct":4.886},{"t":1792393740,"equity":9639.4,"drawdown_pct":4.738},{"t":1792393740,"equity":9614.4,"drawdown_pct":4.985},{"t":1792411200,"equity":9615.25,"drawdown_pct":4.976}],"recent_outcomes":["W","W","L","L","L","L","B","W","W","L","W","L","W","L","L","W","L","W","L","W","W","L","W","L"]}
